{
  "schema_version": "1.0",
  "request_id": "33333333-3333-3333-3333-333333333333",
  "submitted_at": "2026-06-14T13:00:00Z",
  "submitted_by": "WitnessVault",
  "identity": {
    "custody_id": "CUST-2026-0001",
    "processed_manifest_id": "22222222-2222-2222-2222-222222222222",
    "case_id": "CASE-2026-001"
  },
  "files": [
    {
      "role": "transcript",
      "path": "/vault/processed/CUST-2026-0001.txt",
      "filename": "CUST-2026-0001.txt",
      "sha256": "bbbbbbbbbbbbbbbbbbbbbbbbbbbbbbbbbbbbbbbbbbbbbbbbbbbbbbbbbbbbbbbb",
      "size_bytes": 25000,
      "include_in_bundle": true
    },
    {
      "role": "raw_audio",
      "path": "/vault/raw/CUST-2026-0001.m4a",
      "filename": "CUST-2026-0001.m4a",
      "sha256": "aaaaaaaaaaaaaaaaaaaaaaaaaaaaaaaaaaaaaaaaaaaaaaaaaaaaaaaaaaaaaaaa",
      "size_bytes": 1048576,
      "include_in_bundle": true
    }
  ],
  "encryption": {
    "algorithm": "AES-256-GCM",
    "key_source": "sigilforge_managed",
    "key_id": null,
    "recipients": [
      { "name": "Jarvis", "key_fingerprint": null }
    ]
  },
  "bundle": {
    "format": "zip+gpg",
    "include_manifest": true,
    "include_chain_of_custody": true,
    "output_path": "/vault/bundles/CUST-2026-0001.zip.gpg"
  },
  "metadata": {
    "sensitivity": "standard",
    "event_date": "2026-06-10",
    "description": "Meeting recording bundle"
  }
}
